<?xml version="1.0"?>
<xs:schema attributeFormDefault="unqualified" elementFormDefault="qualified" xmlns:xs="http://www.w3.org/2001/XMLSchema">
    <xs:element name="chat">
        <xs:complexType>
            <xs:sequence>
                <xs:element name="users">
                    <xs:complexType>
                        <xs:sequence>
                            <xs:element name="me">
                                <xs:complexType>
                                    <xs:sequence>
                                        <xs:element type="xs:int" name="id"/>
                                        <xs:element type="xs:string" name="userName"/>
                                    </xs:sequence>
                                </xs:complexType>
                            </xs:element>
                            <xs:element name="notMe">
                                <xs:complexType>
                                    <xs:sequence>
                                        <xs:element type="xs:string" name="name" maxOccurs="unbounded" minOccurs="1"/>
                                    </xs:sequence>
                                </xs:complexType>
                            </xs:element>
                        </xs:sequence>
                    </xs:complexType>
                </xs:element>
                <xs:element name="messages">
                    <xs:complexType>
                        <xs:sequence>
                            <xs:element name="message" maxOccurs="unbounded" minOccurs="0">
                                <xs:complexType>
                                    <xs:sequence>
                                        <xs:element type="xs:int" name="from"/>
                                        
                                        <xs:element type="xs:string" name="color"/>
                                        <xs:element type="xs:string" name="font"/>
                                        <xs:element type="xs:string" name="senderName"/>
                                        <xs:element type="xs:string" name="text"/>
                    
                                    </xs:sequence>
                                </xs:complexType>
                            </xs:element>
                        </xs:sequence>
                    </xs:complexType>
                </xs:element>
            </xs:sequence>
        </xs:complexType>
    </xs:element>
</xs:schema>